{"id":"professional","description":"Professional decision-makers who need clarity and actionable structure.","applicability":["business","teaching","analysis"],"constraints":["moderate density","short labels","visible hierarchy"],"recommendations":["lead with implication","use one anchor per slide"],"forbidden_patterns":["unlabeled decoration","dense paragraphs"],"selection_signals":{"audience":["professional","executive"]},"relationships":{"purpose":["analysis","teaching"],"style":["clean-tech-blue","geometric-duotone-thesis"],"typography":["arabic_formal"]},"priority":0.8,"confidence":0.9,"data":{"max_density":"moderate"}}
